{
  "$schema": "../schemas/mgf.folderTemplate.schema.json",
  "templateKey": "domain_nas_root",
  "displayName": "Domain NAS Root",
  "description": "Top-level NAS taxonomy for archive/offload and global assets.",
  "root": {
    "name": "NAS_ROOT",
    "children": [
      { "name": "00_Admin", "optional": true },
      { "name": "01_ProjectsArchive" },
      { "name": "02_Originals_Dumps" },
      {
        "name": "05_GlobalAssets",
        "kind": "folder",
        "children": [
          { "name": "01_Graphic_Library" },
          { "name": "02_Music_Library" },
          { "name": "03_SFX_Library" },
          { "name": "04_Video_Library" },
          { "name": "05_Color" },
          { "name": "06_Plugins" },
          { "name": "07_Scripts" },
          { "name": "08_Configs" },
          { "name": "09_Captures" },
          { "name": "10_Projects" },
          { "name": "11_Secret_Sauce" }
        ]
      },
      { "name": "97_Legacy_RO" },
      { "name": "98_Archive_Cold" },
      { "name": "99_Temp" }
    ]
  }
}
